{
  "task_id": "pybughive_scrapy_1265",
  "bug_family": "test_failure_triage",
  "split": "heldout",
  "repo": {
    "name": "scrapy",
    "source": "pybughive",
    "url": "https://github.com/scrapy/scrapy.git",
    "commit": "bd2fe996aabe5467a89d9eff6831e6b0bf731be4",
    "language": "python"
  },
  "environment": {
    "python_version": "3.8",
    "install_command": "pipenv --python 3.8\npipenv run python -m pip install pytest\npipenv run python -m pip install twisted[tls]\npipenv run python -m pip install -r requirements.txt\npipenv run python -m pip install .",
    "test_command": "pipenv run pytest tests/test_utils_conf.py\npipenv run pytest tests/test_utils_deprecate.py",
    "full_test_command": null,
    "timeout_seconds": 300
  },
  "failure": {
    "failing_tests": [
      "tests/test_utils_conf.py",
      "tests/test_utils_deprecate.py"
    ],
    "error_type": "PyBugHiveTestFailure",
    "error_message": "Backward incompatibility for relocated paths in settings",
    "failure_log_path": "logs/initial_failure.txt"
  },
  "ground_truth": {
    "patch_path": "../../../patches/pybughive/pybughive_scrapy_1265_fix.patch",
    "modified_files": [
      "scrapy/utils/conf.py",
      "scrapy/utils/deprecate.py"
    ],
    "bug_summary": "Backward incompatibility for relocated paths in settings"
  },
  "benchmark": {
    "name": "pybughive",
    "project": "scrapy",
    "issue_id": 1265,
    "buggy_commit": "bd2fe996aabe5467a89d9eff6831e6b0bf731be4",
    "fix_commit": "d52cf8bb036ce2dc6cfbe63f78cfd172cc7c888d",
    "test_patch_path": "../../../patches/pybughive/pybughive_scrapy_1265_tests.patch",
    "metadata_path": "../../../data/pybughive/pybughive_scrapy_1265/metadata.json",
    "original_install_steps": "pipenv --python 3.8\npipenv install pytest\npipenv install twisted[tls]\npipenv install -r requirements.txt\npipenv install .",
    "original_test_steps": "pipenv run pytest tests/test_utils_conf.py\npipenv run pytest tests/test_utils_deprecate.py",
    "original_full_test_steps": null
  },
  "labels": {
    "surface_pattern": "assertion_or_behavior_mismatch",
    "root_cause": "cross_file_behavior_regression",
    "requires_api_knowledge": false,
    "adversarial_reason": null
  }
}
