{
  "task_id": "local_whitespace_title_bug",
  "bug_family": "test_failure_triage",
  "split": "heldout",
  "repo": {
    "name": "local_whitespace_title_bug",
    "source": "local",
    "url": "../../fixtures/local_whitespace_title_bug",
    "commit": "WORKTREE",
    "language": "python"
  },
  "environment": {
    "python_version": "3.11",
    "install_command": "python -c \"import pytest\"",
    "test_command": "python -m pytest tests/test_title.py::test_whitespace_title_uses_default -q",
    "full_test_command": "python -m pytest -q",
    "timeout_seconds": 120
  },
  "failure": {
    "failing_tests": [
      "tests/test_title.py::test_whitespace_title_uses_default"
    ],
    "error_type": "AssertionError",
    "error_message": "Expected default title for whitespace-only input.",
    "failure_log_path": "logs/initial_failure.txt"
  },
  "ground_truth": {
    "patch_path": "../../patches/local_whitespace_title_bug.patch",
    "modified_files": [
      "src/text_title/title.py"
    ],
    "bug_summary": "Whitespace-only input returns an empty string instead of the default title."
  },
  "labels": {
    "surface_pattern": "assertion_mismatch",
    "root_cause": "missing_edge_case_handling",
    "requires_api_knowledge": false,
    "adversarial_reason": null
  }
}
