{
  "task_id": "pybughive_black_193",
  "bug_family": "test_failure_triage",
  "split": "heldout",
  "repo": {
    "name": "black",
    "source": "pybughive",
    "url": "https://github.com/psf/black.git",
    "commit": "8b64e916f65f2c1023f9abd6243a904bfbcd8fe9",
    "language": "python"
  },
  "environment": {
    "python_version": "3.7",
    "install_command": "pipenv --python 3.7\npipenv run python -m pip install setuptools==68.0.0\npipenv install\npipenv run python -m pip install click==8.0.2\npipenv run python -m pip install pytest==6.2.5",
    "test_command": "pipenv run python setup.py test",
    "full_test_command": "pipenv run python setup.py test",
    "timeout_seconds": 300
  },
  "failure": {
    "failing_tests": [
      "tests/composition.py",
      "tests/empty_lines.py",
      "tests/expression.diff",
      "tests/expression.py"
    ],
    "error_type": "PyBugHiveTestFailure",
    "error_message": "can't format python2 valid syntax",
    "failure_log_path": "logs/initial_failure.txt"
  },
  "ground_truth": {
    "patch_path": "../../../patches/pybughive_hard/pybughive_black_193_fix.patch",
    "modified_files": [
      "README.md",
      "black.py"
    ],
    "bug_summary": "can't format python2 valid syntax"
  },
  "benchmark": {
    "name": "pybughive",
    "project": "black",
    "issue_id": 193,
    "buggy_commit": "8b64e916f65f2c1023f9abd6243a904bfbcd8fe9",
    "fix_commit": "5a47fd13cc4c9f43270dd12c37577244c1eabfcc",
    "test_patch_path": "../../../patches/pybughive_hard/pybughive_black_193_tests.patch",
    "metadata_path": "../../../data/pybughive_hard/pybughive_black_193/metadata.json",
    "original_install_steps": "pipenv --python 3.7\npipenv install setuptools==68.0.0\npipenv install\npipenv install click==8.0.2\npipenv install pytest==6.2.5",
    "original_test_steps": "pipenv run python setup.py test",
    "original_full_test_steps": "pipenv run python setup.py test"
  },
  "labels": {
    "surface_pattern": "assertion_or_behavior_mismatch",
    "root_cause": "cross_file_behavior_regression",
    "requires_api_knowledge": false,
    "adversarial_reason": null
  }
}
