{
  "task_id": "pybughive_black_154",
  "bug_family": "test_failure_triage",
  "split": "heldout",
  "repo": {
    "name": "black",
    "source": "pybughive",
    "url": "https://github.com/psf/black.git",
    "commit": "29e97d1d4a7717f1bd0ca35cacf2f2ce6d815b0c",
    "language": "python"
  },
  "environment": {
    "python_version": "3.7",
    "install_command": "pipenv --python 3.7\npipenv run python -m pip install setuptools==68.0.0\npipenv install\npipenv run python -m pip install click==8.0.2\npipenv run python -m pip install pytest==6.2.5",
    "test_command": "pipenv run python setup.py test",
    "full_test_command": "pipenv run python setup.py test",
    "timeout_seconds": 300
  },
  "failure": {
    "failing_tests": [
      "tests/comments2.py",
      "tests/comments5.py",
      "tests/empty_lines.py",
      "tests/fmtonoff.py",
      "tests/test_black.py"
    ],
    "error_type": "PyBugHiveTestFailure",
    "error_message": "Adds blank lines after comment between decorators",
    "failure_log_path": "logs/initial_failure.txt"
  },
  "ground_truth": {
    "patch_path": "../../../patches/pybughive_hard/pybughive_black_154_fix.patch",
    "modified_files": [
      "README.md",
      "black.py"
    ],
    "bug_summary": "Adds blank lines after comment between decorators"
  },
  "benchmark": {
    "name": "pybughive",
    "project": "black",
    "issue_id": 154,
    "buggy_commit": "29e97d1d4a7717f1bd0ca35cacf2f2ce6d815b0c",
    "fix_commit": "52fda8b0e9e52e94aae6cb3170c9b1b492a2d8b4",
    "test_patch_path": "../../../patches/pybughive_hard/pybughive_black_154_tests.patch",
    "metadata_path": "../../../data/pybughive_hard/pybughive_black_154/metadata.json",
    "original_install_steps": "pipenv --python 3.7\npipenv install setuptools==68.0.0\npipenv install\npipenv install click==8.0.2\npipenv install pytest==6.2.5",
    "original_test_steps": "pipenv run python setup.py test",
    "original_full_test_steps": "pipenv run python setup.py test"
  },
  "labels": {
    "surface_pattern": "assertion_or_behavior_mismatch",
    "root_cause": "cross_file_behavior_regression",
    "requires_api_knowledge": false,
    "adversarial_reason": null
  }
}
