{
  "task_id": "pybughive_black_232",
  "bug_family": "test_failure_triage",
  "split": "heldout",
  "repo": {
    "name": "black",
    "source": "pybughive",
    "url": "https://github.com/psf/black.git",
    "commit": "23a00f051576d2e7edd18b6af382902cc34ea4a2",
    "language": "python"
  },
  "environment": {
    "python_version": "3.7",
    "install_command": "pipenv --python 3.7\npipenv run python -m pip install setuptools==68.0.0\npipenv install\npipenv run python -m pip install click==8.0.2\npipenv run python -m pip install pytest==6.2.5",
    "test_command": "pipenv run python setup.py test",
    "full_test_command": "pipenv run python setup.py test",
    "timeout_seconds": 300
  },
  "failure": {
    "failing_tests": [
      "tests/cantfit.py"
    ],
    "error_type": "PyBugHiveTestFailure",
    "error_message": "Multiline strings cause unnecessary optional parentheses",
    "failure_log_path": "logs/initial_failure.txt"
  },
  "ground_truth": {
    "patch_path": "../../../patches/pybughive_hard/pybughive_black_232_fix.patch",
    "modified_files": [
      "README.md",
      "black.py"
    ],
    "bug_summary": "Multiline strings cause unnecessary optional parentheses"
  },
  "benchmark": {
    "name": "pybughive",
    "project": "black",
    "issue_id": 232,
    "buggy_commit": "23a00f051576d2e7edd18b6af382902cc34ea4a2",
    "fix_commit": "d638d56e0e383caeeff048e76b02b50b29367c3d",
    "test_patch_path": "../../../patches/pybughive_hard/pybughive_black_232_tests.patch",
    "metadata_path": "../../../data/pybughive_hard/pybughive_black_232/metadata.json",
    "original_install_steps": "pipenv --python 3.7\npipenv install setuptools==68.0.0\npipenv install\npipenv install click==8.0.2\npipenv install pytest==6.2.5",
    "original_test_steps": "pipenv run python setup.py test",
    "original_full_test_steps": "pipenv run python setup.py test"
  },
  "labels": {
    "surface_pattern": "assertion_or_behavior_mismatch",
    "root_cause": "cross_file_behavior_regression",
    "requires_api_knowledge": false,
    "adversarial_reason": null
  }
}
