{
  "task_id": "pybughive_black_297",
  "bug_family": "test_failure_triage",
  "split": "train",
  "repo": {
    "name": "black",
    "source": "pybughive",
    "url": "https://github.com/psf/black.git",
    "commit": "728e5a2f1ed16e2cfe0ca5586edac6c10da436c5",
    "language": "python"
  },
  "environment": {
    "python_version": "3.7",
    "install_command": "pipenv --python 3.7\npipenv run python -m pip install setuptools==68.0.0\npipenv install\npipenv run python -m pip install click==8.0.2\npipenv run python -m pip install pytest==6.2.5",
    "test_command": "pipenv run python setup.py test",
    "full_test_command": "pipenv run python setup.py test",
    "timeout_seconds": 300
  },
  "failure": {
    "failing_tests": [
      "tests/expression.diff",
      "tests/expression.py"
    ],
    "error_type": "PyBugHiveTestFailure",
    "error_message": "Additional space after star unpacking",
    "failure_log_path": "logs/initial_failure.txt"
  },
  "ground_truth": {
    "patch_path": "../../../patches/pybughive/pybughive_black_297_fix.patch",
    "modified_files": [
      "black.py"
    ],
    "bug_summary": "Additional space after star unpacking"
  },
  "benchmark": {
    "name": "pybughive",
    "project": "black",
    "issue_id": 297,
    "buggy_commit": "728e5a2f1ed16e2cfe0ca5586edac6c10da436c5",
    "fix_commit": "bbc09a4f013f2a584f143f3f5e3f76f6082367d4",
    "test_patch_path": "../../../patches/pybughive/pybughive_black_297_tests.patch",
    "metadata_path": "../../../data/pybughive/pybughive_black_297/metadata.json",
    "original_install_steps": "pipenv --python 3.7\npipenv install setuptools==68.0.0\npipenv install\npipenv install click==8.0.2\npipenv install pytest==6.2.5",
    "original_test_steps": "pipenv run python setup.py test",
    "original_full_test_steps": "pipenv run python setup.py test"
  },
  "labels": {
    "surface_pattern": "assertion_or_behavior_mismatch",
    "root_cause": "localized_behavior_regression",
    "requires_api_knowledge": false,
    "adversarial_reason": null
  }
}
