{
  "task_id": "pybughive_black_59",
  "bug_family": "test_failure_triage",
  "split": "heldout",
  "repo": {
    "name": "black",
    "source": "pybughive",
    "url": "https://github.com/psf/black.git",
    "commit": "c9f8983936a3e4bf02ae4f71e9ccd0006baa5169",
    "language": "python"
  },
  "environment": {
    "python_version": "3.7",
    "install_command": "pipenv --python 3.7\npipenv run python -m pip install setuptools==68.0.0\npipenv install\npipenv run python -m pip install click==8.0.2\npipenv run python -m pip install pytest==6.2.5",
    "test_command": "pipenv run python setup.py test",
    "full_test_command": "pipenv run python setup.py test",
    "timeout_seconds": 300
  },
  "failure": {
    "failing_tests": [
      "tests/expression.py"
    ],
    "error_type": "PyBugHiveTestFailure",
    "error_message": "Internal error on a complex variable type annotation",
    "failure_log_path": "logs/initial_failure.txt"
  },
  "ground_truth": {
    "patch_path": "../../../patches/pybughive/pybughive_black_59_fix.patch",
    "modified_files": [
      "black.py"
    ],
    "bug_summary": "Internal error on a complex variable type annotation"
  },
  "benchmark": {
    "name": "pybughive",
    "project": "black",
    "issue_id": 59,
    "buggy_commit": "c9f8983936a3e4bf02ae4f71e9ccd0006baa5169",
    "fix_commit": "a970a205bcea73672e85468836b477d3262ee75e",
    "test_patch_path": "../../../patches/pybughive/pybughive_black_59_tests.patch",
    "metadata_path": "../../../data/pybughive/pybughive_black_59/metadata.json",
    "original_install_steps": "pipenv --python 3.7\npipenv install setuptools==68.0.0\npipenv install\npipenv install click==8.0.2\npipenv install pytest==6.2.5",
    "original_test_steps": "pipenv run python setup.py test",
    "original_full_test_steps": "pipenv run python setup.py test"
  },
  "labels": {
    "surface_pattern": "exception_or_crash",
    "root_cause": "localized_behavior_regression",
    "requires_api_knowledge": false,
    "adversarial_reason": null
  }
}
