{
  "task_id": "pybughive_black_1632",
  "bug_family": "test_failure_triage",
  "split": "heldout",
  "repo": {
    "name": "black",
    "source": "pybughive",
    "url": "https://github.com/psf/black.git",
    "commit": "62c2b167bcf22683fc11add2f24a132d36e8fd19",
    "language": "python"
  },
  "environment": {
    "python_version": "3.7",
    "install_command": "pipenv --python 3.7\npipenv run python -m pip install setuptools==68.0.0\npipenv run pip install -r test_requirements.txt\npipenv run python -m pip install click==8.0.2\npipenv run python -m pip install pytest==6.2.5\npipenv run pip install -e .[d]",
    "test_command": "pipenv run pytest -- tests/test_format.py",
    "full_test_command": "pipenv run pytest",
    "timeout_seconds": 300
  },
  "failure": {
    "failing_tests": [
      "tests/data/docstring.py",
      "tests/data/docstring_preview.py",
      "tests/test_format.py"
    ],
    "error_type": "PyBugHiveTestFailure",
    "error_message": "Docstrings reformatted to be too long",
    "failure_log_path": "logs/initial_failure.txt"
  },
  "ground_truth": {
    "patch_path": "../../../patches/pybughive_hard/pybughive_black_1632_fix.patch",
    "modified_files": [
      "CHANGES.md",
      "src/black/linegen.py",
      "src/black/mode.py"
    ],
    "bug_summary": "Docstrings reformatted to be too long"
  },
  "benchmark": {
    "name": "pybughive",
    "project": "black",
    "issue_id": 1632,
    "buggy_commit": "62c2b167bcf22683fc11add2f24a132d36e8fd19",
    "fix_commit": "20d8ccb54253f8a66321f6708d53e2a05a54079b",
    "test_patch_path": "../../../patches/pybughive_hard/pybughive_black_1632_tests.patch",
    "metadata_path": "../../../data/pybughive_hard/pybughive_black_1632/metadata.json",
    "original_install_steps": "pipenv --python 3.7\npipenv install setuptools==68.0.0\npipenv run pip install -r test_requirements.txt\npipenv install click==8.0.2\npipenv install pytest==6.2.5\npipenv run pip install -e .[d]\n",
    "original_test_steps": "pipenv run pytest -- tests/test_format.py",
    "original_full_test_steps": "pipenv run pytest"
  },
  "labels": {
    "surface_pattern": "assertion_or_behavior_mismatch",
    "root_cause": "cross_file_behavior_regression",
    "requires_api_knowledge": false,
    "adversarial_reason": null
  }
}
